{
  "schema_version": 1,
  "canonical_sku": "USW-Pro-Max-16",
  "display_name": "Pro Max 16",
  "device_type": "switch",
  "official_evidence_ids": [
    "official-usw-pro-max-16-techspecs-20260830"
  ],
  "runtime_identifiers": {
    "api_model": [],
    "sysid": [],
    "ssh_model": []
  },
  "ports": {
    "complete": true,
    "items": [
      {
        "index": 1,
        "label": "RJ45-1",
        "connector": "rj45",
        "roles": [
          "lan"
        ],
        "max_speed_mbps": 1000,
        "poe_in": false,
        "poe_out": false,
        "poe_standard": null,
        "poe_max_power_w": null,
        "combo_group": null
      },
      {
        "index": 2,
        "label": "RJ45-2",
        "connector": "rj45",
        "roles": [
          "lan"
        ],
        "max_speed_mbps": 1000,
        "poe_in": false,
        "poe_out": false,
        "poe_standard": null,
        "poe_max_power_w": null,
        "combo_group": null
      },
      {
        "index": 3,
        "label": "RJ45-3",
        "connector": "rj45",
        "roles": [
          "lan"
        ],
        "max_speed_mbps": 1000,
        "poe_in": false,
        "poe_out": false,
        "poe_standard": null,
        "poe_max_power_w": null,
        "combo_group": null
      },
      {
        "index": 4,
        "label": "RJ45-4",
        "connector": "rj45",
        "roles": [
          "lan"
        ],
        "max_speed_mbps": 1000,
        "poe_in": false,
        "poe_out": false,
        "poe_standard": null,
        "poe_max_power_w": null,
        "combo_group": null
      },
      {
        "index": 5,
        "label": "RJ45-5",
        "connector": "rj45",
        "roles": [
          "lan"
        ],
        "max_speed_mbps": 1000,
        "poe_in": false,
        "poe_out": false,
        "poe_standard": null,
        "poe_max_power_w": null,
        "combo_group": null
      },
      {
        "index": 6,
        "label": "RJ45-6",
        "connector": "rj45",
        "roles": [
          "lan"
        ],
        "max_speed_mbps": 1000,
        "poe_in": false,
        "poe_out": false,
        "poe_standard": null,
        "poe_max_power_w": null,
        "combo_group": null
      },
      {
        "index": 7,
        "label": "RJ45-7",
        "connector": "rj45",
        "roles": [
          "lan"
        ],
        "max_speed_mbps": 1000,
        "poe_in": false,
        "poe_out": false,
        "poe_standard": null,
        "poe_max_power_w": null,
        "combo_group": null
      },
      {
        "index": 8,
        "label": "RJ45-8",
        "connector": "rj45",
        "roles": [
          "lan"
        ],
        "max_speed_mbps": 1000,
        "poe_in": false,
        "poe_out": false,
        "poe_standard": null,
        "poe_max_power_w": null,
        "combo_group": null
      },
      {
        "index": 9,
        "label": "RJ45-9",
        "connector": "rj45",
        "roles": [
          "lan"
        ],
        "max_speed_mbps": 1000,
        "poe_in": false,
        "poe_out": false,
        "poe_standard": null,
        "poe_max_power_w": null,
        "combo_group": null
      },
      {
        "index": 10,
        "label": "RJ45-10",
        "connector": "rj45",
        "roles": [
          "lan"
        ],
        "max_speed_mbps": 1000,
        "poe_in": false,
        "poe_out": false,
        "poe_standard": null,
        "poe_max_power_w": null,
        "combo_group": null
      },
      {
        "index": 11,
        "label": "RJ45-11",
        "connector": "rj45",
        "roles": [
          "lan"
        ],
        "max_speed_mbps": 1000,
        "poe_in": false,
        "poe_out": false,
        "poe_standard": null,
        "poe_max_power_w": null,
        "combo_group": null
      },
      {
        "index": 12,
        "label": "RJ45-12",
        "connector": "rj45",
        "roles": [
          "lan"
        ],
        "max_speed_mbps": 1000,
        "poe_in": false,
        "poe_out": false,
        "poe_standard": null,
        "poe_max_power_w": null,
        "combo_group": null
      },
      {
        "index": 13,
        "label": "RJ45-13",
        "connector": "rj45",
        "roles": [
          "lan"
        ],
        "max_speed_mbps": 2500,
        "poe_in": false,
        "poe_out": false,
        "poe_standard": null,
        "poe_max_power_w": null,
        "combo_group": null
      },
      {
        "index": 14,
        "label": "RJ45-14",
        "connector": "rj45",
        "roles": [
          "lan"
        ],
        "max_speed_mbps": 2500,
        "poe_in": false,
        "poe_out": false,
        "poe_standard": null,
        "poe_max_power_w": null,
        "combo_group": null
      },
      {
        "index": 15,
        "label": "RJ45-15",
        "connector": "rj45",
        "roles": [
          "lan"
        ],
        "max_speed_mbps": 2500,
        "poe_in": false,
        "poe_out": false,
        "poe_standard": null,
        "poe_max_power_w": null,
        "combo_group": null
      },
      {
        "index": 16,
        "label": "RJ45-16",
        "connector": "rj45",
        "roles": [
          "lan"
        ],
        "max_speed_mbps": 2500,
        "poe_in": false,
        "poe_out": false,
        "poe_standard": null,
        "poe_max_power_w": null,
        "combo_group": null
      },
      {
        "index": 17,
        "label": "SFP+-1",
        "connector": "sfp_plus",
        "roles": [
          "lan"
        ],
        "max_speed_mbps": 10000,
        "poe_in": false,
        "poe_out": false,
        "poe_standard": null,
        "poe_max_power_w": null,
        "combo_group": null
      },
      {
        "index": 18,
        "label": "SFP+-2",
        "connector": "sfp_plus",
        "roles": [
          "lan"
        ],
        "max_speed_mbps": 10000,
        "poe_in": false,
        "poe_out": false,
        "poe_standard": null,
        "poe_max_power_w": null,
        "combo_group": null
      }
    ]
  },
  "storage": {
    "complete": false,
    "items": []
  },
  "power": {
    "source_type": "external_adapter",
    "psu_slots": null,
    "psu_unit_capacity_w": null,
    "controller_reference_capacity_w": null,
    "max_device_consumption_w": 25,
    "absolute_max_poe_budget_w": 0,
    "power_profiles": [
      {
        "id": "ac-adapter",
        "status": "verified",
        "selection_mode": "fixed",
        "input_method": "ac_adapter",
        "input_poe_class": null,
        "input_capacity_w": 25,
        "poe_budget_w": null,
        "field_evidence": {
          "selection_mode": {
            "status": "verified",
            "evidence_ids": [
              "official-usw-pro-max-16-techspecs-20260830"
            ]
          },
          "input_method": {
            "status": "verified",
            "evidence_ids": [
              "official-usw-pro-max-16-techspecs-20260830"
            ]
          },
          "input_poe_class": {
            "status": "not_applicable",
            "evidence_ids": [
              "official-usw-pro-max-16-techspecs-20260830"
            ]
          },
          "input_capacity_w": {
            "status": "verified",
            "evidence_ids": [
              "official-usw-pro-max-16-techspecs-20260830"
            ]
          },
          "poe_budget_w": {
            "status": "not_applicable",
            "evidence_ids": [
              "official-usw-pro-max-16-techspecs-20260830"
            ]
          }
        }
      },
      {
        "id": "usb-c",
        "status": "verified",
        "selection_mode": "fixed",
        "input_method": "usb_c",
        "input_poe_class": null,
        "input_capacity_w": 25,
        "poe_budget_w": null,
        "field_evidence": {
          "selection_mode": {
            "status": "verified",
            "evidence_ids": [
              "official-usw-pro-max-16-techspecs-20260830"
            ]
          },
          "input_method": {
            "status": "verified",
            "evidence_ids": [
              "official-usw-pro-max-16-techspecs-20260830"
            ]
          },
          "input_poe_class": {
            "status": "not_applicable",
            "evidence_ids": [
              "official-usw-pro-max-16-techspecs-20260830"
            ]
          },
          "input_capacity_w": {
            "status": "verified",
            "evidence_ids": [
              "official-usw-pro-max-16-techspecs-20260830"
            ]
          },
          "poe_budget_w": {
            "status": "not_applicable",
            "evidence_ids": [
              "official-usw-pro-max-16-techspecs-20260830"
            ]
          }
        }
      }
    ]
  },
  "fans": {
    "status": "unknown",
    "count": null
  }
}
