{
  "schema_version": 1,
  "canonical_sku": "U6-IW",
  "display_name": "U6 In-Wall",
  "device_type": "ap",
  "official_evidence_ids": [
    "official-u6-iw-techspecs-20260830"
  ],
  "runtime_identifiers": {
    "api_model": [{
      "value": "U6 IW",
      "status": "verified",
      "provenance": "qualified_controller",
      "evidence_id": "runtime-u6-iw-controller-identity-20260901"
    }],
    "sysid": [],
    "ssh_model": []
  },
  "ports": {
    "complete": true,
    "items": [
      {
        "index": 1,
        "label": "Port 1",
        "connector": "rj45",
        "roles": [
          "lan",
          "downstream",
          "poe_passthrough"
        ],
        "max_speed_mbps": 1000,
        "poe_in": false,
        "poe_out": true,
        "poe_standard": null,
        "poe_max_power_w": null,
        "combo_group": null
      },
      {
        "index": 2,
        "label": "Port 2",
        "connector": "rj45",
        "roles": [
          "lan",
          "downstream"
        ],
        "max_speed_mbps": 1000,
        "poe_in": false,
        "poe_out": null,
        "poe_standard": null,
        "poe_max_power_w": null,
        "combo_group": null
      },
      {
        "index": 3,
        "label": "Port 3",
        "connector": "rj45",
        "roles": [
          "lan",
          "downstream"
        ],
        "max_speed_mbps": 1000,
        "poe_in": false,
        "poe_out": null,
        "poe_standard": null,
        "poe_max_power_w": null,
        "combo_group": null
      },
      {
        "index": 4,
        "label": "Port 4",
        "connector": "rj45",
        "roles": [
          "lan",
          "downstream"
        ],
        "max_speed_mbps": 1000,
        "poe_in": false,
        "poe_out": null,
        "poe_standard": null,
        "poe_max_power_w": null,
        "combo_group": null
      },
      {
        "index": 5,
        "label": "Port 5",
        "connector": "rj45",
        "roles": [
          "lan",
          "uplink",
          "data_in"
        ],
        "max_speed_mbps": 1000,
        "poe_in": true,
        "poe_out": false,
        "poe_standard": null,
        "poe_max_power_w": null,
        "combo_group": null
      }
    ]
  },
  "storage": {
    "complete": false,
    "items": []
  },
  "power": {
    "source_type": "poe_powered",
    "psu_slots": null,
    "psu_unit_capacity_w": null,
    "controller_reference_capacity_w": null,
    "max_device_consumption_w": 13,
    "absolute_max_poe_budget_w": null,
    "power_profiles": [
      {
        "id": "poe",
        "status": "verified",
        "selection_mode": "auto_detected",
        "input_method": "poe",
        "input_poe_class": null,
        "input_capacity_w": null,
        "poe_budget_w": null,
        "field_evidence": {
          "selection_mode": {
            "status": "verified",
            "evidence_ids": [
              "official-u6-iw-techspecs-20260830"
            ]
          },
          "input_method": {
            "status": "verified",
            "evidence_ids": [
              "official-u6-iw-techspecs-20260830"
            ]
          },
          "input_poe_class": {
            "status": "unknown",
            "evidence_ids": [
              "official-u6-iw-techspecs-20260830"
            ]
          },
          "input_capacity_w": {
            "status": "unknown",
            "evidence_ids": [
              "official-u6-iw-techspecs-20260830"
            ]
          },
          "poe_budget_w": {
            "status": "unknown",
            "evidence_ids": [
              "official-u6-iw-techspecs-20260830"
            ]
          }
        }
      }
    ]
  },
  "fans": {
    "status": "unknown",
    "count": null
  }
}
