{
  "schema_version": 1,
  "canonical_sku": "USW-Pro-Max-16-PoE",
  "display_name": "Pro Max 16 PoE",
  "device_type": "switch",
  "official_evidence_ids": [
    "official-usw-pro-max-16-poe-techspecs-20260830"
  ],
  "runtime_identifiers": {
    "api_model": [{
      "value": "USW Pro Max 16 PoE",
      "status": "verified",
      "provenance": "qualified_controller",
      "evidence_id": "runtime-usw-pro-max-16-poe-controller-identity-20260831"
    }],
    "sysid": [],
    "ssh_model": []
  },
  "ports": {
    "complete": true,
    "items": [
      {
        "index": 1,
        "label": "Port 1",
        "connector": "rj45",
        "roles": [
          "lan"
        ],
        "max_speed_mbps": 1000,
        "poe_in": false,
        "poe_out": true,
        "poe_standard": "poe+",
        "poe_max_power_w": 30,
        "combo_group": null
      },
      {
        "index": 2,
        "label": "Port 2",
        "connector": "rj45",
        "roles": [
          "lan"
        ],
        "max_speed_mbps": 1000,
        "poe_in": false,
        "poe_out": true,
        "poe_standard": "poe+",
        "poe_max_power_w": 30,
        "combo_group": null
      },
      {
        "index": 3,
        "label": "Port 3",
        "connector": "rj45",
        "roles": [
          "lan"
        ],
        "max_speed_mbps": 1000,
        "poe_in": false,
        "poe_out": true,
        "poe_standard": "poe+",
        "poe_max_power_w": 30,
        "combo_group": null
      },
      {
        "index": 4,
        "label": "Port 4",
        "connector": "rj45",
        "roles": [
          "lan"
        ],
        "max_speed_mbps": 1000,
        "poe_in": false,
        "poe_out": true,
        "poe_standard": "poe+",
        "poe_max_power_w": 30,
        "combo_group": null
      },
      {
        "index": 5,
        "label": "Port 5",
        "connector": "rj45",
        "roles": [
          "lan"
        ],
        "max_speed_mbps": 1000,
        "poe_in": false,
        "poe_out": true,
        "poe_standard": "poe+",
        "poe_max_power_w": 30,
        "combo_group": null
      },
      {
        "index": 6,
        "label": "Port 6",
        "connector": "rj45",
        "roles": [
          "lan"
        ],
        "max_speed_mbps": 1000,
        "poe_in": false,
        "poe_out": true,
        "poe_standard": "poe+",
        "poe_max_power_w": 30,
        "combo_group": null
      },
      {
        "index": 7,
        "label": "Port 7",
        "connector": "rj45",
        "roles": [
          "lan"
        ],
        "max_speed_mbps": 1000,
        "poe_in": false,
        "poe_out": true,
        "poe_standard": "poe+",
        "poe_max_power_w": 30,
        "combo_group": null
      },
      {
        "index": 8,
        "label": "Port 8",
        "connector": "rj45",
        "roles": [
          "lan"
        ],
        "max_speed_mbps": 1000,
        "poe_in": false,
        "poe_out": true,
        "poe_standard": "poe+",
        "poe_max_power_w": 30,
        "combo_group": null
      },
      {
        "index": 9,
        "label": "Port 9",
        "connector": "rj45",
        "roles": [
          "lan"
        ],
        "max_speed_mbps": 1000,
        "poe_in": false,
        "poe_out": true,
        "poe_standard": "poe+",
        "poe_max_power_w": 30,
        "combo_group": null
      },
      {
        "index": 10,
        "label": "Port 10",
        "connector": "rj45",
        "roles": [
          "lan"
        ],
        "max_speed_mbps": 1000,
        "poe_in": false,
        "poe_out": true,
        "poe_standard": "poe+",
        "poe_max_power_w": 30,
        "combo_group": null
      },
      {
        "index": 11,
        "label": "Port 11",
        "connector": "rj45",
        "roles": [
          "lan"
        ],
        "max_speed_mbps": 1000,
        "poe_in": false,
        "poe_out": true,
        "poe_standard": "poe+",
        "poe_max_power_w": 30,
        "combo_group": null
      },
      {
        "index": 12,
        "label": "Port 12",
        "connector": "rj45",
        "roles": [
          "lan"
        ],
        "max_speed_mbps": 1000,
        "poe_in": false,
        "poe_out": true,
        "poe_standard": "poe+",
        "poe_max_power_w": 30,
        "combo_group": null
      },
      {
        "index": 13,
        "label": "Port 13",
        "connector": "rj45",
        "roles": [
          "lan"
        ],
        "max_speed_mbps": 2500,
        "poe_in": false,
        "poe_out": true,
        "poe_standard": "poe++",
        "poe_max_power_w": 60,
        "combo_group": null
      },
      {
        "index": 14,
        "label": "Port 14",
        "connector": "rj45",
        "roles": [
          "lan"
        ],
        "max_speed_mbps": 2500,
        "poe_in": false,
        "poe_out": true,
        "poe_standard": "poe++",
        "poe_max_power_w": 60,
        "combo_group": null
      },
      {
        "index": 15,
        "label": "Port 15",
        "connector": "rj45",
        "roles": [
          "lan"
        ],
        "max_speed_mbps": 2500,
        "poe_in": false,
        "poe_out": true,
        "poe_standard": "poe++",
        "poe_max_power_w": 60,
        "combo_group": null
      },
      {
        "index": 16,
        "label": "Port 16",
        "connector": "rj45",
        "roles": [
          "lan"
        ],
        "max_speed_mbps": 2500,
        "poe_in": false,
        "poe_out": true,
        "poe_standard": "poe++",
        "poe_max_power_w": 60,
        "combo_group": null
      },
      {
        "index": 17,
        "label": "Port 17",
        "connector": "sfp_plus",
        "roles": [
          "lan"
        ],
        "max_speed_mbps": 10000,
        "poe_in": false,
        "poe_out": false,
        "poe_standard": null,
        "poe_max_power_w": null,
        "combo_group": null
      },
      {
        "index": 18,
        "label": "Port 18",
        "connector": "sfp_plus",
        "roles": [
          "lan"
        ],
        "max_speed_mbps": 10000,
        "poe_in": false,
        "poe_out": false,
        "poe_standard": null,
        "poe_max_power_w": null,
        "combo_group": null
      }
    ]
  },
  "storage": {
    "complete": false,
    "items": []
  },
  "power": {
    "source_type": "external_adapter",
    "psu_slots": null,
    "psu_unit_capacity_w": null,
    "controller_reference_capacity_w": null,
    "max_device_consumption_w": 210,
    "absolute_max_poe_budget_w": 180,
    "power_profiles": [
      {
        "id": "ac-adapter-210w",
        "status": "verified",
        "selection_mode": "fixed",
        "input_method": "ac_adapter",
        "input_poe_class": null,
        "input_capacity_w": 210,
        "poe_budget_w": 180,
        "field_evidence": {
          "selection_mode": {
            "status": "verified",
            "evidence_ids": [
              "official-usw-pro-max-16-poe-techspecs-20260830"
            ]
          },
          "input_method": {
            "status": "verified",
            "evidence_ids": [
              "official-usw-pro-max-16-poe-techspecs-20260830"
            ]
          },
          "input_poe_class": {
            "status": "not_applicable",
            "evidence_ids": [
              "official-usw-pro-max-16-poe-techspecs-20260830"
            ]
          },
          "input_capacity_w": {
            "status": "verified",
            "evidence_ids": [
              "official-usw-pro-max-16-poe-techspecs-20260830"
            ]
          },
          "poe_budget_w": {
            "status": "verified",
            "evidence_ids": [
              "official-usw-pro-max-16-poe-techspecs-20260830"
            ]
          }
        }
      }
    ]
  },
  "fans": {
    "status": "unknown",
    "count": null
  }
}
