{
  "schema_version": 1,
  "canonical_sku": "USW-Flex",
  "display_name": "Flex",
  "device_type": "switch",
  "official_evidence_ids": [
    "official-usw-flex-techspecs-20260830"
  ],
  "runtime_identifiers": {
    "api_model": [{
      "value": "USW Flex",
      "status": "verified",
      "provenance": "qualified_controller",
      "evidence_id": "runtime-usw-flex-controller-identity-20260831"
    }],
    "sysid": [],
    "ssh_model": []
  },
  "ports": {
    "complete": true,
    "items": [
      {
        "index": 1,
        "label": "Port 1",
        "connector": "rj45",
        "roles": [
          "lan"
        ],
        "max_speed_mbps": 1000,
        "poe_in": true,
        "poe_out": false,
        "poe_standard": "poe++",
        "poe_max_power_w": null,
        "combo_group": null
      },
      {
        "index": 2,
        "label": "Port 2",
        "connector": "rj45",
        "roles": [
          "lan"
        ],
        "max_speed_mbps": 1000,
        "poe_in": false,
        "poe_out": true,
        "poe_standard": "poe+",
        "poe_max_power_w": 25,
        "combo_group": null
      },
      {
        "index": 3,
        "label": "Port 3",
        "connector": "rj45",
        "roles": [
          "lan"
        ],
        "max_speed_mbps": 1000,
        "poe_in": false,
        "poe_out": true,
        "poe_standard": "poe+",
        "poe_max_power_w": 25,
        "combo_group": null
      },
      {
        "index": 4,
        "label": "Port 4",
        "connector": "rj45",
        "roles": [
          "lan"
        ],
        "max_speed_mbps": 1000,
        "poe_in": false,
        "poe_out": true,
        "poe_standard": "poe+",
        "poe_max_power_w": 25,
        "combo_group": null
      },
      {
        "index": 5,
        "label": "Port 5",
        "connector": "rj45",
        "roles": [
          "lan"
        ],
        "max_speed_mbps": 1000,
        "poe_in": false,
        "poe_out": true,
        "poe_standard": "poe+",
        "poe_max_power_w": 25,
        "combo_group": null
      }
    ]
  },
  "storage": {
    "complete": false,
    "items": []
  },
  "power": {
    "source_type": "poe_powered",
    "psu_slots": null,
    "psu_unit_capacity_w": null,
    "controller_reference_capacity_w": null,
    "max_device_consumption_w": 51,
    "absolute_max_poe_budget_w": 46,
    "power_profiles": [
      {
        "id": "poe",
        "status": "verified",
        "selection_mode": "auto_detected",
        "input_method": "poe",
        "input_poe_class": "poe",
        "input_capacity_w": null,
        "poe_budget_w": 8,
        "field_evidence": {
          "selection_mode": {
            "status": "verified",
            "evidence_ids": [
              "official-usw-flex-techspecs-20260830"
            ]
          },
          "input_method": {
            "status": "verified",
            "evidence_ids": [
              "official-usw-flex-techspecs-20260830"
            ]
          },
          "input_poe_class": {
            "status": "verified",
            "evidence_ids": [
              "official-usw-flex-techspecs-20260830"
            ]
          },
          "input_capacity_w": {
            "status": "unknown",
            "evidence_ids": [
              "official-usw-flex-techspecs-20260830"
            ]
          },
          "poe_budget_w": {
            "status": "verified",
            "evidence_ids": [
              "official-usw-flex-techspecs-20260830"
            ]
          }
        }
      },
      {
        "id": "poe-plus",
        "status": "verified",
        "selection_mode": "auto_detected",
        "input_method": "poe",
        "input_poe_class": "poe+",
        "input_capacity_w": null,
        "poe_budget_w": 20,
        "field_evidence": {
          "selection_mode": {
            "status": "verified",
            "evidence_ids": [
              "official-usw-flex-techspecs-20260830"
            ]
          },
          "input_method": {
            "status": "verified",
            "evidence_ids": [
              "official-usw-flex-techspecs-20260830"
            ]
          },
          "input_poe_class": {
            "status": "verified",
            "evidence_ids": [
              "official-usw-flex-techspecs-20260830"
            ]
          },
          "input_capacity_w": {
            "status": "unknown",
            "evidence_ids": [
              "official-usw-flex-techspecs-20260830"
            ]
          },
          "poe_budget_w": {
            "status": "verified",
            "evidence_ids": [
              "official-usw-flex-techspecs-20260830"
            ]
          }
        }
      },
      {
        "id": "poe-plus-plus",
        "status": "verified",
        "selection_mode": "auto_detected",
        "input_method": "poe",
        "input_poe_class": "poe++",
        "input_capacity_w": null,
        "poe_budget_w": 46,
        "field_evidence": {
          "selection_mode": {
            "status": "verified",
            "evidence_ids": [
              "official-usw-flex-techspecs-20260830"
            ]
          },
          "input_method": {
            "status": "verified",
            "evidence_ids": [
              "official-usw-flex-techspecs-20260830"
            ]
          },
          "input_poe_class": {
            "status": "verified",
            "evidence_ids": [
              "official-usw-flex-techspecs-20260830"
            ]
          },
          "input_capacity_w": {
            "status": "unknown",
            "evidence_ids": [
              "official-usw-flex-techspecs-20260830"
            ]
          },
          "poe_budget_w": {
            "status": "verified",
            "evidence_ids": [
              "official-usw-flex-techspecs-20260830"
            ]
          }
        }
      },
      {
        "id": "poe-adapter-60w",
        "status": "verified",
        "selection_mode": "fixed",
        "input_method": "dc_adapter",
        "input_poe_class": null,
        "input_capacity_w": 60,
        "poe_budget_w": 46,
        "field_evidence": {
          "selection_mode": {
            "status": "verified",
            "evidence_ids": [
              "official-usw-flex-techspecs-20260830"
            ]
          },
          "input_method": {
            "status": "verified",
            "evidence_ids": [
              "official-usw-flex-techspecs-20260830"
            ]
          },
          "input_poe_class": {
            "status": "not_applicable",
            "evidence_ids": [
              "official-usw-flex-techspecs-20260830"
            ]
          },
          "input_capacity_w": {
            "status": "verified",
            "evidence_ids": [
              "official-usw-flex-techspecs-20260830"
            ]
          },
          "poe_budget_w": {
            "status": "verified",
            "evidence_ids": [
              "official-usw-flex-techspecs-20260830"
            ]
          }
        }
      }
    ]
  },
  "fans": {
    "status": "unknown",
    "count": null
  }
}
